{
    "schemaVersion": 1,
    "workOrderId": "final-review-secure-public-stream-contract",
    "changeId": "secure-public-stream-contract",
    "role": "integration",
    "taskIds": [
        "8.1"
    ],
    "acceptedArtifactDigest": "6d29b5f600acf766a18fcf2a8ca6fb862246dc632a0c3dbefcf802b96b5e7e7e",
    "baseSha": "73f45982808fc514a82bf989890fe92fc90e45c3",
    "issuedBy": "codex-coordinator",
    "issuedAt": "2026-08-14T11:33:46.8058808Z",
    "allowedPaths": [
        "backend/API_DOCUMENTATION.md",
        "backend/src/streams/controllers/index.ts",
        "backend/src/streams/controllers/map-stream-to-public-stream.mapper.ts",
        "backend/src/streams/controllers/streams.controller.ts",
        "backend/src/streams/domain/types/index.ts",
        "backend/src/streams/domain/types/public-stream.types.ts",
        "backend/test/streams/controllers/ingest.controller.test.ts",
        "backend/test/streams/controllers/streams.controller.test.ts",
        "docs/adr/0021-secure-public-stream-contract.md",
        "docs/adr/README.md",
        "docs/adr/index.md",
        "docs/features/streams.md",
        "docs/index.md",
        "docs/specification-map.md",
        "docs/subsystems/stream-reservation-and-publication.md",
        "frontend/src/lib/lifecycle.ts",
        "frontend/src/mocks/fixtures.ts",
        "frontend/src/mocks/handlers.ts",
        "frontend/src/test/api-contract.test.ts",
        "frontend/src/test/lifecycle.test.ts",
        "frontend/src/types/index.ts",
        "openspec/changes/archive/2026-08-14-secure-public-stream-contract/.openspec.yaml",
        "openspec/changes/archive/2026-08-14-secure-public-stream-contract/acceptance.json",
        "openspec/changes/archive/2026-08-14-secure-public-stream-contract/design.md",
        "openspec/changes/archive/2026-08-14-secure-public-stream-contract/evidence/4ae80247dd43cbc0921885702f1a8cae42814f19/checkpoint.json",
        "openspec/changes/archive/2026-08-14-secure-public-stream-contract/evidence/4ae80247dd43cbc0921885702f1a8cae42814f19/review-report.json",
        "openspec/changes/archive/2026-08-14-secure-public-stream-contract/evidence/4ae80247dd43cbc0921885702f1a8cae42814f19/work-order.json",
        "openspec/changes/archive/2026-08-14-secure-public-stream-contract/proposal.md",
        "openspec/changes/archive/2026-08-14-secure-public-stream-contract/specs/public-stream-contract/spec.md",
        "openspec/changes/archive/2026-08-14-secure-public-stream-contract/tasks.md",
        "openspec/changes/secure-public-stream-contract/.openspec.yaml",
        "openspec/changes/secure-public-stream-contract/acceptance.json",
        "openspec/changes/secure-public-stream-contract/design.md",
        "openspec/changes/secure-public-stream-contract/proposal.md",
        "openspec/changes/secure-public-stream-contract/specs/public-stream-contract/spec.md",
        "openspec/changes/secure-public-stream-contract/tasks.md",
        "openspec/specs/public-stream-contract/spec.md"
    ],
    "forbiddenPaths": [
        "AGENTS.md",
        "CLAUDE.md",
        "backend/CONVENTIONS.md",
        "backend/src/streams/domain/types/stream-reservation.types.ts",
        "backend/src/streams/domain/types/stream.types.ts",
        "backend/src/streams/infrastructure/repositories/mongo-stream.repository.ts",
        "backend/src/streams/infrastructure/schemas/stream.schema.ts",
        "backend/src/streams/services/publish-auth.service.ts",
        "docs/adr/0013-reserve-publish-ingest-cluster.md"
    ],
    "protectedPaths": [
        ".claude/settings.local.json"
    ],
    "expectedAdditions": [
        "backend/src/streams/controllers/map-stream-to-public-stream.mapper.ts",
        "backend/src/streams/domain/types/public-stream.types.ts",
        "backend/test/streams/controllers/ingest.controller.test.ts",
        "docs/adr/0021-secure-public-stream-contract.md",
        "frontend/src/test/lifecycle.test.ts",
        "openspec/changes/archive/2026-08-14-secure-public-stream-contract/evidence/4ae80247dd43cbc0921885702f1a8cae42814f19/checkpoint.json",
        "openspec/changes/archive/2026-08-14-secure-public-stream-contract/evidence/4ae80247dd43cbc0921885702f1a8cae42814f19/review-report.json",
        "openspec/changes/archive/2026-08-14-secure-public-stream-contract/evidence/4ae80247dd43cbc0921885702f1a8cae42814f19/work-order.json",
        "openspec/specs/public-stream-contract/spec.md"
    ],
    "expectedModifications": [
        "backend/API_DOCUMENTATION.md",
        "backend/src/streams/controllers/index.ts",
        "backend/src/streams/controllers/streams.controller.ts",
        "backend/src/streams/domain/types/index.ts",
        "backend/test/streams/controllers/streams.controller.test.ts",
        "docs/adr/README.md",
        "docs/adr/index.md",
        "docs/features/streams.md",
        "docs/index.md",
        "docs/specification-map.md",
        "docs/subsystems/stream-reservation-and-publication.md",
        "frontend/src/lib/lifecycle.ts",
        "frontend/src/mocks/fixtures.ts",
        "frontend/src/mocks/handlers.ts",
        "frontend/src/test/api-contract.test.ts",
        "frontend/src/types/index.ts"
    ],
    "expectedDeletions": [],
    "expectedRenames": [
        {
            "from": "openspec/changes/secure-public-stream-contract/.openspec.yaml",
            "to": "openspec/changes/archive/2026-08-14-secure-public-stream-contract/.openspec.yaml"
        },
        {
            "from": "openspec/changes/secure-public-stream-contract/acceptance.json",
            "to": "openspec/changes/archive/2026-08-14-secure-public-stream-contract/acceptance.json"
        },
        {
            "from": "openspec/changes/secure-public-stream-contract/design.md",
            "to": "openspec/changes/archive/2026-08-14-secure-public-stream-contract/design.md"
        },
        {
            "from": "openspec/changes/secure-public-stream-contract/proposal.md",
            "to": "openspec/changes/archive/2026-08-14-secure-public-stream-contract/proposal.md"
        },
        {
            "from": "openspec/changes/secure-public-stream-contract/specs/public-stream-contract/spec.md",
            "to": "openspec/changes/archive/2026-08-14-secure-public-stream-contract/specs/public-stream-contract/spec.md"
        },
        {
            "from": "openspec/changes/secure-public-stream-contract/tasks.md",
            "to": "openspec/changes/archive/2026-08-14-secure-public-stream-contract/tasks.md"
        }
    ],
    "requiredDocuments": [
        "backend/CONVENTIONS.md",
        "docs/adr/0013-reserve-publish-ingest-cluster.md",
        "docs/adr/0017-feature-and-subsystem-documentation.md",
        "docs/adr/0018-establish-accepted-local-agent-workflow.md",
        "docs/adr/0021-secure-public-stream-contract.md",
        "openspec/changes/archive/2026-08-14-secure-public-stream-contract/acceptance.json",
        "openspec/changes/archive/2026-08-14-secure-public-stream-contract/design.md",
        "openspec/changes/archive/2026-08-14-secure-public-stream-contract/evidence/4ae80247dd43cbc0921885702f1a8cae42814f19/checkpoint.json",
        "openspec/changes/archive/2026-08-14-secure-public-stream-contract/evidence/4ae80247dd43cbc0921885702f1a8cae42814f19/review-report.json",
        "openspec/changes/archive/2026-08-14-secure-public-stream-contract/evidence/4ae80247dd43cbc0921885702f1a8cae42814f19/work-order.json",
        "openspec/changes/archive/2026-08-14-secure-public-stream-contract/proposal.md",
        "openspec/changes/archive/2026-08-14-secure-public-stream-contract/specs/public-stream-contract/spec.md",
        "openspec/changes/archive/2026-08-14-secure-public-stream-contract/tasks.md",
        "openspec/specs/public-stream-contract/spec.md"
    ],
    "conventionIds": [
        "ARCH-01",
        "DATA-06",
        "DOC-01",
        "DOC-03",
        "DOC-05",
        "DOC-06",
        "DTO-02",
        "NAME-02",
        "NAME-03",
        "SVC-05",
        "TEST-01",
        "TEST-02",
        "TEST-05",
        "TEST-06",
        "TOOL-01",
        "TOOL-02",
        "TOOL-05",
        "TOOL-09",
        "TYPE-02",
        "TYPE-03"
    ],
    "focusedCommands": [
        {
            "commandId": "final-integration-review-tests",
            "cwd": ".",
            "argv": [
                "node",
                "--test",
                "test/agent-workflow/review-validation.test.mjs"
            ]
        }
    ],
    "nonGoals": [
        "Do not amend the archived candidate, implementation evidence, canonical specification, or product behavior during final review.",
        "Do not change token persistence, authorization, schemas, events, dependencies, configuration, or deployment topology.",
        "Do not advance master before exact final review and final evidence validation pass.",
        "Do not conflate the acceptance-bearing authorization base with the original accepted merge baseline."
    ],
    "stopConditions": [
        "Stop if the archived candidate SHA, tree, first-parent history, inventory, accepted digest, or unique archive location changes.",
        "Stop if implementation evidence does not relocate byte-exactly or its evidence-only commit is invalid.",
        "Stop if any root, OpenSpec, checkpoint, final-review, or evidence-commit check fails.",
        "Stop if protected user state changes or master no longer equals 468fa64141ccd2afe70846499e74c89ee9020852."
    ]
}
